{
  "schemaVersion": 1,
  "id": "acdf",
  "abbreviation": "ACDF",
  "version": "1.0.0",
  "revision": 1,
  "titleKey": "procedure.title",
  "summaryKey": "procedure.summary",
  "asset": {
    "id": "acdf_model",
    "version": "1.0.0"
  },
  "sceneFile": "content/ios-scenes/acdf.json",
  "locales": [
    "en",
    "ja"
  ],
  "steps": [
    {
      "id": "acdf_overview",
      "titleKey": "step.overview.title",
      "bodyKey": "step.overview.body",
      "accessibilitySummaryKey": "step.overview.accessibility",
      "viewPolicy": "preserveAdjustment"
    },
    {
      "id": "acdf_indications",
      "titleKey": "step.indications.title",
      "bodyKey": "step.indications.body",
      "accessibilitySummaryKey": "step.indications.accessibility",
      "viewPolicy": "reframe"
    },
    {
      "id": "acdf_discectomy",
      "titleKey": "step.discectomy.title",
      "bodyKey": "step.discectomy.body",
      "accessibilitySummaryKey": "step.discectomy.accessibility",
      "viewPolicy": "reframe"
    },
    {
      "id": "acdf_cage_types",
      "titleKey": "step.cage_types.title",
      "bodyKey": "step.cage_types.body",
      "accessibilitySummaryKey": "step.cage_types.accessibility",
      "viewPolicy": "reframe"
    },
    {
      "id": "acdf_cage_implantation",
      "titleKey": "step.cage_implantation.title",
      "bodyKey": "step.cage_implantation.body",
      "accessibilitySummaryKey": "step.cage_implantation.accessibility",
      "viewPolicy": "reframe"
    },
    {
      "id": "acdf_anterior_fixation",
      "titleKey": "step.anterior_fixation.title",
      "bodyKey": "step.anterior_fixation.body",
      "accessibilitySummaryKey": "step.anterior_fixation.accessibility",
      "viewPolicy": "reframe"
    },
    {
      "id": "acdf_summary",
      "titleKey": "step.summary.title",
      "bodyKey": "step.summary.body",
      "accessibilitySummaryKey": "step.summary.accessibility",
      "viewPolicy": "reframe"
    }
  ]
}
